{
  "description": "N3 uplink GTP-U T-PDU containing an ICMP echo request",
  "expect": {
    "display_filter": "gtp && icmp",
    "fields": {
      "gtp.message": "0xff",
      "gtp.teid": "0x00007cd5",
      "icmp.seq": "1",
      "icmp.type": "8",
      "ip.dst": "10.53.1.3,8.8.8.8",
      "ip.src": "10.53.1.5,10.45.0.16",
      "udp.dstport": "2152",
      "udp.srcport": "2152"
    },
    "packet_count": 1
  },
  "id": "gtpu_n3_uplink_icmp_echo_request",
  "packet": {
    "ethernet": {
      "dst": "02:00:00:00:00:03",
      "src": "02:00:00:00:00:05"
    },
    "gtpu": {
      "flags": "0x30",
      "message_type": "0xff",
      "teid": "0x00007cd5"
    },
    "icmp_echo": {
      "code": 0,
      "identifier": "0x0013",
      "payload": "5G O-RAN replay uplink",
      "sequence": 1,
      "type": 8
    },
    "inner_ipv4": {
      "dst": "8.8.8.8",
      "identification": "0x1001",
      "src": "10.45.0.16",
      "ttl": 64
    },
    "outer_ipv4": {
      "dst": "10.53.1.3",
      "identification": "0x2001",
      "src": "10.53.1.5",
      "ttl": 64
    },
    "udp": {
      "dst_port": 2152,
      "src_port": 2152
    }
  },
  "protocol": "GTP-U",
  "schema_version": 1
}
